{
    "job_id": 913,
    "job_details": {
        "job_id": 913,
        "Organisatienaam": "HackerOne",
        "Type adverteerder": "Directe werkgever",
        "Vacaturetitel": "Software Engineer III",
        "Standplaats": null,
        "Vacaturelink (origineel)": "indeed.com",
        "Contactpersoon": null,
        "Telefoonnummer": null,
        "E-mail": null,
        "Beroep": "Software engineer (m/v/x)",
        "Opleidingsniveau": "Onbekend",
        "Jobfeed feedbacklink": "Meld fout",
        "Functieomschrijving": "At HackerOne, we're on a mission to empower the world to build a safer internet. We're a growing engineering team with an outsized impact, and we're looking for a Software Engineer IC3 to help us innovate and propel our platform forward.\n\n   As a Software Engineer IC3, you will work with the seniors of the team, and with Product Managers and Designers and build delightful features and products for our community, as well as the thousands of companies who trust HackerOne with their cybersecurity posture.\n\n   You are a collaborative and effective software engineer and team member. You will interact with CSM's, who are the voice of our customers. You will guide and coach the more junior IC's.\n\n   You'll combine your technological expertise, domain knowledge, and an unquestionable dedication to business objectives as you intersect with the engineering organization. You identify and make systematic improvements to technical weaknesses you'll find in your squad's codebases, and in shared codebases across the company.\n\n   Your Journey at HackerOne\n     * Your day will start with a warm welcome online and get your tools to start!\n     * Your first 30 days will be focusing on getting to know our HackerOnies. You will join your new squad and being onboarded - get to learn the technology stack (Ruby on Rails + GraphQL + ReactJS + many more)\n     * Within 60 days, you will have committed a bunch of code to our repositories and will start developing a knack for being a fast and effective software engineer on our codebase\n     * Within 90 days, you will start getting ready to lead your first project as Software Engineer - you will have branched out and talked to Sales, Marketing and various other functions, and developed a good sense of cross-functional collaboration and communication\n     * Beyond 90 days, you will be a fully-fledged software engineer\n     * By that time you will be able to understand the business value of our products and features, and the needs of our customers\n     * And you are able to translate feature requests into simple, but robust engineering (or non-engineering) solutions, You can:\n     * Make an impact on a squad and project level.\n     * Coordinate efforts around new initiatives with the senior engineers\n\n   HackerOne Values\n\n   HackerOne commits to maintaining the strong, inclusive culture we've built for our employees and our community of hackers. As a team, we\n     * Lead with integrity. Integrity is doing the right thing when no one is watching\n     * Default to disclosure. Ask \"Why should this be private?\" instead of \"Why should this be public?\"\n     * Execute with excellence. Hold yourself and others to the highest standards of performance\n     * Win as a team. Compete to achieve excellence. Enable each other to do our best\n     * Respect all people. We prioritize diversity, equity, inclusion, and dignity for all\n\n   Compensation Bands:\n   Tier Guide\n\n   UK and Ireland: 72k-85k pounds",
        "Datum gevonden": "2025-01-21",
        "Beroepsgroep": "Programmeurs",
        "Beroepsklasse": "Informatie- en communicatietechnologie",
        "Contracttype": "Vast contract",
        "Parttime / fulltime": "Fulltime (> 32 uur)",
        "Branche": "ICT",
        "Organisatiegrootte": "1-9",
        "Jaar (van datum gevonden)": 2025,
        "Maand (van datum gevonden)": 1,
        "full_text": "Software Engineer III\n\nAt HackerOne, we're on a mission to empower the world to build a safer internet. We're a growing engineering team with an outsized impact, and we're looking for a Software Engineer IC3 to help us innovate and propel our platform forward.\n\n   As a Software Engineer IC3, you will work with the seniors of the team, and with Product Managers and Designers and build delightful features and products for our community, as well as the thousands of companies who trust HackerOne with their cybersecurity posture.\n\n   You are a collaborative and effective software engineer and team member. You will interact with CSM's, who are the voice of our customers. You will guide and coach the more junior IC's.\n\n   You'll combine your technological expertise, domain knowledge, and an unquestionable dedication to business objectives as you intersect with the engineering organization. You identify and make systematic improvements to technical weaknesses you'll find in your squad's codebases, and in shared codebases across the company.\n\n   Your Journey at HackerOne\n     * Your day will start with a warm welcome online and get your tools to start!\n     * Your first 30 days will be focusing on getting to know our HackerOnies. You will join your new squad and being onboarded - get to learn the technology stack (Ruby on Rails + GraphQL + ReactJS + many more)\n     * Within 60 days, you will have committed a bunch of code to our repositories and will start developing a knack for being a fast and effective software engineer on our codebase\n     * Within 90 days, you will start getting ready to lead your first project as Software Engineer - you will have branched out and talked to Sales, Marketing and various other functions, and developed a good sense of cross-functional collaboration and communication\n     * Beyond 90 days, you will be a fully-fledged software engineer\n     * By that time you will be able to understand the business value of our products and features, and the needs of our customers\n     * And you are able to translate feature requests into simple, but robust engineering (or non-engineering) solutions, You can:\n     * Make an impact on a squad and project level.\n     * Coordinate efforts around new initiatives with the senior engineers\n\n   HackerOne Values\n\n   HackerOne commits to maintaining the strong, inclusive culture we've built for our employees and our community of hackers. As a team, we\n     * Lead with integrity. Integrity is doing the right thing when no one is watching\n     * Default to disclosure. Ask \"Why should this be private?\" instead of \"Why should this be public?\"\n     * Execute with excellence. Hold yourself and others to the highest standards of performance\n     * Win as a team. Compete to achieve excellence. Enable each other to do our best\n     * Respect all people. We prioritize diversity, equity, inclusion, and dignity for all\n\n   Compensation Bands:\n   Tier Guide\n\n   UK and Ireland: 72k-85k pounds"
    },
    "analysis": {
        "job_profile_classification": {
            "profile": "Ambiguous / Not Relevant",
            "confidence_score": 2,
            "rationale": "The job description focuses heavily on traditional software engineering tasks and business alignment, with no mention of AI, machine learning, or generative models. It lacks the core technical elements required for ML Engineer or GenAI Engineer profiles."
        },
        "thematic_analysis": {
            "job_tasks": [
                {
                    "category": "TASK1: Business Understanding",
                    "phrases": [
                        "empower the world to build a safer internet",
                        "propel our platform forward",
                        "understand the business value of our products and features",
                        "translate feature requests into simple, but robust engineering (or non-engineering) solutions",
                        "unquestionable dedication to business objectives"
                    ],
                    "justification": "These phrases indicate a need to understand the company's mission, strategic goals, and how technical work contributes to business value and customer needs."
                },
                {
                    "category": "TASK4: Software Development",
                    "phrases": [
                        "Software Engineer III",
                        "build delightful features and products",
                        "collaborative and effective software engineer",
                        "technological expertise",
                        "identify and make systematic improvements to technical weaknesses you'll find in your squad's codebases, and in shared codebases across the company",
                        "get your tools to start!",
                        "learn the technology stack (Ruby on Rails + GraphQL + ReactJS + many more)",
                        "committed a bunch of code to our repositories",
                        "developing a knack for being a fast and effective software engineer on our codebase",
                        "lead your first project as Software Engineer",
                        "fully-fledged software engineer",
                        "robust engineering (or non-engineering) solutions"
                    ],
                    "justification": "The job title and numerous phrases directly refer to software engineering activities, including building features, coding, working with technology stacks, and improving codebases."
                },
                {
                    "category": "SKILL1: Communication & Collaboration",
                    "phrases": [
                        "work with the seniors of the team, and with Product Managers and Designers",
                        "collaborative and effective software engineer and team member",
                        "interact with CSM's, who are the voice of our customers",
                        "guide and coach the more junior IC's",
                        "talked to Sales, Marketing and various other functions",
                        "developed a good sense of cross-functional collaboration and communication",
                        "Coordinate efforts around new initiatives with the senior engineers",
                        "Win as a team. Compete to achieve excellence. Enable each other to do our best",
                        "Respect all people. We prioritize diversity, equity, inclusion, and dignity for all"
                    ],
                    "justification": "The description emphasizes working with various teams (Product, Design, CSM, Sales, Marketing), coaching junior engineers, and coordinating efforts, highlighting strong communication and collaboration needs."
                },
                {
                    "category": "SKILL2: Learning & Adaptability",
                    "phrases": [
                        "growing engineering team",
                        "focusing on getting to know our HackerOnies. You will join your new squad and being onboarded - get to learn the technology stack",
                        "developing a knack for being a fast and effective software engineer on our codebase",
                        "talked to Sales, Marketing and various other functions, and developed a good sense of cross-functional collaboration and communication"
                    ],
                    "justification": "The onboarding process and the expectation to quickly become effective on a new codebase and learn about different functions suggest a need for learning and adaptability."
                },
                {
                    "category": "SKILL3: Problem Solving & Pragmatism",
                    "phrases": [
                        "innovate and propel our platform forward",
                        "identify and make systematic improvements to technical weaknesses",
                        "translate feature requests into simple, but robust engineering (or non-engineering) solutions",
                        "Make an impact on a squad and project level."
                    ],
                    "justification": "The role involves identifying technical weaknesses, translating requests into solutions, and making an impact, all of which require problem-solving and a pragmatic approach."
                },
                {
                    "category": "SKILL5: Innovation & Ownership",
                    "phrases": [
                        "innovate and propel our platform forward",
                        "lead your first project as Software Engineer",
                        "Make an impact on a squad and project level.",
                        "Coordinate efforts around new initiatives",
                        "Execute with excellence. Hold yourself and others to the highest standards of performance",
                        "Lead with integrity. Integrity is doing the right thing when no one is watching"
                    ],
                    "justification": "Phrases like 'innovate', 'lead your first project', 'make an impact', and 'coordinate efforts' suggest a proactive and ownership-driven mindset, along with a focus on excellence and integrity."
                }
            ],
            "technologies": [
                {
                    "category": "TECH1: Programming Languages",
                    "technologies": [
                        "Ruby on Rails",
                        "GraphQL",
                        "ReactJS"
                    ]
                },
                {
                    "category": "TECH4: LLM Frameworks & Libraries",
                    "technologies": [
                        "many more"
                    ]
                }
            ],
            "soft_skills": [
                {
                    "category": "SKILL1: Communication & Collaboration",
                    "skills": [
                        "collaborative and effective software engineer and team member",
                        "interact with CSM's",
                        "guide and coach the more junior IC's",
                        "talked to Sales, Marketing and various other functions",
                        "developed a good sense of cross-functional communication",
                        "Coordinate efforts around new initiatives",
                        "Win as a team",
                        "Respect all people"
                    ]
                },
                {
                    "category": "SKILL2: Learning & Adaptability",
                    "skills": [
                        "get to learn the technology stack",
                        "developing a knack for being a fast and effective software engineer"
                    ]
                },
                {
                    "category": "SKILL3: Problem Solving & Pragmatism",
                    "skills": [
                        "innovate and propel our platform forward",
                        "identify and make systematic improvements to technical weaknesses",
                        "translate feature requests into simple, but robust engineering (or non-engineering) solutions",
                        "Make an impact on a squad and project level."
                    ]
                },
                {
                    "category": "SKILL5: Innovation & Ownership",
                    "skills": [
                        "innovate and propel our platform forward",
                        "lead your first project as Software Engineer",
                        "Make an impact on a squad and project level.",
                        "Coordinate efforts around new initiatives",
                        "Execute with excellence",
                        "Lead with integrity"
                    ]
                }
            ]
        }
    }
}