{
    "job_id": 942,
    "job_details": {
        "job_id": 942,
        "Organisatienaam": "NVIDIA",
        "Type adverteerder": "Directe werkgever",
        "Vacaturetitel": "Senior Performance Research and Analysis Engineer",
        "Standplaats": "Zwolle",
        "Vacaturelink (origineel)": "engineering.jobs",
        "Contactpersoon": null,
        "Telefoonnummer": null,
        "E-mail": null,
        "Beroep": "R&D ingenieur (m/v/x)",
        "Opleidingsniveau": "WO",
        "Jobfeed feedbacklink": "Meld fout",
        "Functieomschrijving": "NVIDIA is looking for a talented Performance Research Engineer to join our Performance group.\n\n   The ideal candidate will profile and analyze AI workloads on large GPUs and CPUs scale clusters for distributed Deep Learning LLM training focusing at the collectives communication and networking.\n\n   You will work and interact with many types of HW and platforms such as HCAs, Switches, CPUs, GPUs, and Systems.\n\n   You will experience with and develop performance analysis tools and methodologies to dive deeply into the details, understand performance expectation, limitations, and bottlenecks.\n\n   What you'll be doing:\n     * Experience and research AI workloads and DL models specifically tailored for large-scale deep learning LLM training on NVIDIA supercomputers with a focus on High-performance networking.\n     * Benchmarking, Profiling, and Analyzing the performance to find bottlenecks and identify areas of improvement and optimizations, with a strong emphasis on networking aspects.\n     * Implement performance analysis tools.\n     * Collaborating with many teams from HW to SW to provide performance analysis insights.\n     * Define performance test planning , set performance expectations for new technologies and solutions, and work to reach the performance targets limits.\n\n   What we need to see:\n     * B.Sc in Computer Science or Software Engineering\n     * 5+ years of experience with high-performance Networking (RDMA, MPI)\n     * Demonstrated Performance Analysis skills and methodologies.\n     * Experience with NVIDIA GPUs, CUDA library, deep learning frameworks like TensorFlow or PyTorch,\n       combined with expertise in networking collective communication libraries (such as NCCL) and protocols (such as RoCE and RDMA).\n     * Fast and self-learning capabilities with strong analytical and problem-solving skills.\n     * Programming Languages: Python, Bash and C languages\n     * Experience with Linux OS distros.\n     * Team player with good communication and interpersonal skills\n\n   Ways to stand out from the crowd:\n     * In-depth knowledge and experience with AI workloads and benchmarking for distributed LLM training.\n     * Knowledge in CUDA, and NCCL libraries.\n     * Knowledge in Congestion Control algorithms.\n     * In-depth System knowledge and understanding (Intel / AMD / ARM CPUs, NVIDIA GPUs, HCA, Memory, PCI).\n     * Strong Performance Analysis skills and methodologies using modern tools.\n\n   NVIDIA is committed to fostering a diverse work environment and proud to be an equal opportunity employer. As we highly value diversity in our current and future employees, we do not discriminate (including in our hiring and promotion practices) based on race, religion, color, national origin, gender, gender expression, sexual orientation, age, marital status, veteran status, disability status or any other characteristic protected by law.",
        "Datum gevonden": "2024-11-26",
        "Beroepsgroep": "Bedrijfskundig ingenieurs en deskundigen",
        "Beroepsklasse": "Engineering",
        "Contracttype": "Vast contract",
        "Parttime / fulltime": "Fulltime (> 32 uur)",
        "Branche": "Overig / Onbekend",
        "Organisatiegrootte": "Onbekend",
        "Jaar (van datum gevonden)": 2024,
        "Maand (van datum gevonden)": 11,
        "full_text": "Senior Performance Research and Analysis Engineer\n\nNVIDIA is looking for a talented Performance Research Engineer to join our Performance group.\n\n   The ideal candidate will profile and analyze AI workloads on large GPUs and CPUs scale clusters for distributed Deep Learning LLM training focusing at the collectives communication and networking.\n\n   You will work and interact with many types of HW and platforms such as HCAs, Switches, CPUs, GPUs, and Systems.\n\n   You will experience with and develop performance analysis tools and methodologies to dive deeply into the details, understand performance expectation, limitations, and bottlenecks.\n\n   What you'll be doing:\n     * Experience and research AI workloads and DL models specifically tailored for large-scale deep learning LLM training on NVIDIA supercomputers with a focus on High-performance networking.\n     * Benchmarking, Profiling, and Analyzing the performance to find bottlenecks and identify areas of improvement and optimizations, with a strong emphasis on networking aspects.\n     * Implement performance analysis tools.\n     * Collaborating with many teams from HW to SW to provide performance analysis insights.\n     * Define performance test planning , set performance expectations for new technologies and solutions, and work to reach the performance targets limits.\n\n   What we need to see:\n     * B.Sc in Computer Science or Software Engineering\n     * 5+ years of experience with high-performance Networking (RDMA, MPI)\n     * Demonstrated Performance Analysis skills and methodologies.\n     * Experience with NVIDIA GPUs, CUDA library, deep learning frameworks like TensorFlow or PyTorch,\n       combined with expertise in networking collective communication libraries (such as NCCL) and protocols (such as RoCE and RDMA).\n     * Fast and self-learning capabilities with strong analytical and problem-solving skills.\n     * Programming Languages: Python, Bash and C languages\n     * Experience with Linux OS distros.\n     * Team player with good communication and interpersonal skills\n\n   Ways to stand out from the crowd:\n     * In-depth knowledge and experience with AI workloads and benchmarking for distributed LLM training.\n     * Knowledge in CUDA, and NCCL libraries.\n     * Knowledge in Congestion Control algorithms.\n     * In-depth System knowledge and understanding (Intel / AMD / ARM CPUs, NVIDIA GPUs, HCA, Memory, PCI).\n     * Strong Performance Analysis skills and methodologies using modern tools.\n\n   NVIDIA is committed to fostering a diverse work environment and proud to be an equal opportunity employer. As we highly value diversity in our current and future employees, we do not discriminate (including in our hiring and promotion practices) based on race, religion, color, national origin, gender, gender expression, sexual orientation, age, marital status, veteran status, disability status or any other characteristic protected by law."
    },
    "analysis": {
        "profile_classification": {
            "profile": "Ambiguous / Not Relevant",
            "confidence_score": 2,
            "rationale": "The role focuses heavily on performance analysis and optimization of AI workloads, particularly LLM training, but lacks the core development, fine-tuning, or deployment of generative models or predictive systems. It is more about understanding and improving the performance of existing AI infrastructure rather than building AI models or applications."
        },
        "thematic_analysis": {
            "job_tasks": [
                {
                    "task_category": "TASK3: Modeling",
                    "phrases": [
                        "AI workloads",
                        "DL models",
                        "distributed Deep Learning LLM training",
                        "deep learning LLM training",
                        "AI workloads and benchmarking for distributed LLM training"
                    ],
                    "justification": "The job description repeatedly mentions 'AI workloads' and 'DL models', specifically focusing on 'LLM training', which falls under the domain of creating or adapting machine learning models, even if the primary focus is on their performance rather than their creation."
                },
                {
                    "task_category": "TASK4: Software Development",
                    "phrases": [
                        "Implement performance analysis tools",
                        "Programming Languages: Python, Bash and C languages"
                    ],
                    "justification": "The role requires implementing tools and uses programming languages like Python, Bash, and C, which are core to software development, even if the output is for analysis rather than a user-facing application."
                },
                {
                    "task_category": "TASK5: Operations Engineering (MLOps)",
                    "phrases": [
                        "large GPUs and CPUs scale clusters",
                        "distributed Deep Learning LLM training",
                        "performance analysis tools and methodologies",
                        "Benchmarking, Profiling, and Analyzing the performance",
                        "networking aspects",
                        "performance test planning",
                        "set performance expectations",
                        "work to reach the performance targets limits",
                        "high-performance Networking (RDMA, MPI)",
                        "NVIDIA GPUs, CUDA library",
                        "networking collective communication libraries (such as NCCL)",
                        "protocols (such as RoCE and RDMA)",
                        "Linux OS distros",
                        "CUDA, and NCCL libraries",
                        "Congestion Control algorithms",
                        "System knowledge and understanding (Intel / AMD / ARM CPUs, NVIDIA GPUs, HCA, Memory, PCI)"
                    ],
                    "justification": "The role involves working with large-scale clusters, analyzing performance, defining targets, and understanding system components and networking protocols crucial for production environments, aligning with the operational aspects of managing and optimizing AI systems."
                }
            ],
            "technologies": [
                {
                    "technology_category": "TECH3: LLM / Generative Models",
                    "technologies": [
                        "LLM"
                    ]
                },
                {
                    "technology_category": "TECH10: Data Modeling",
                    "technologies": [
                        "TensorFlow",
                        "PyTorch"
                    ]
                },
                {
                    "technology_category": "TECH1: Programming Languages",
                    "technologies": [
                        "Python",
                        "Bash",
                        "C"
                    ]
                },
                {
                    "technology_category": "TECH2: Cloud Platforms & Services",
                    "technologies": [
                        "NVIDIA GPUs",
                        "CUDA library",
                        "NCCL",
                        "HCA",
                        "Intel / AMD / ARM CPUs"
                    ]
                },
                {
                    "technology_category": "TECH6: MLOps & Data Pipelines",
                    "technologies": [
                        "RDMA",
                        "MPI",
                        "RoCE"
                    ]
                }
            ],
            "soft_skills": [
                {
                    "skill_category": "SKILL3: Problem Solving & Pragmatism",
                    "phrases": [
                        "profile and analyze",
                        "dive deeply into the details",
                        "understand performance expectation, limitations, and bottlenecks",
                        "find bottlenecks and identify areas of improvement and optimizations",
                        "strong analytical and problem-solving skills",
                        "Strong Performance Analysis skills and methodologies"
                    ]
                },
                {
                    "skill_category": "SKILL2: Learning & Adaptability",
                    "phrases": [
                        "Fast and self-learning capabilities"
                    ]
                },
                {
                    "skill_category": "SKILL1: Communication & Collaboration",
                    "phrases": [
                        "Collaborating with many teams from HW to SW",
                        "Team player with good communication and interpersonal skills"
                    ]
                }
            ]
        }
    }
}