{
    "job_id": 491,
    "job_details": {
        "job_id": 491,
        "Organisatienaam": "Genmab",
        "Type adverteerder": "Directe werkgever",
        "Vacaturetitel": "Senior Software Engineer, DevSecOps Release Mgmt, R&D Digital Products",
        "Standplaats": "Utrecht",
        "Vacaturelink (origineel)": "vacaturesinfarma.nl",
        "Contactpersoon": null,
        "Telefoonnummer": null,
        "E-mail": null,
        "Beroep": "Productingenieur (m/v/x)",
        "Opleidingsniveau": "WO",
        "Jobfeed feedbacklink": "Meld fout",
        "Functieomschrijving": "Your Role : We are looking for an innovation-centric Senior Software Engineer, DevSecOps Release Management ( R&D ) to join our IT R&D (Research & Development) Team who is passionate about leading the O rganizational T ransformation in developing DevSecOps tooling, practices, and culture for Genmab's Research and Development Department . You will contribute to R&D-wide DevSecOps requirements and ensure adoption of same, including observability, scalability, availability, security, cost performance. The Senior Software Engineer will also be responsible for DevSecOps technical expertise in Product-oriented-delivery teams, and ensuring that the PODs are executed on time , working with a team of architects and developers . The Senior Software Engineer will support R esearch , Discovery and D evelopment activities and leverage DevSecOps tool kits such as GitLab SaaS v ersion control software, Terraform, Cloud Formation, to ensure smooth and secure delivery of R&D\n   Digital Products, build and deploy scalable and resilient applications. The Senior Software Engineer, DevSecOps Release Management will be instrumental in maintaining robust CI/CD pipelines, enhancing security practices, optimizing cloud resource managemen t , driving operational efficiency and success for the R&D Organization.\n\n   This position will be based out of our Princeton, NJ , Copenhagen, DK or Utrecht, NL and onsite 60% .\n\n   Your Responsibility :\n     * Develop and maintain CI/CD pipelines using GitLab to streamline testing, deployment, and monitoring of applications and their associated infrastructure for software applications and systems used by the R&D Organization for R&D functions such as Research Informatics, SDMS (Scientific Data Management System), Lab Management Systems, Lab and Data Integrations, Research Data products, Pathology, Imaging, Pharmacology, Development Operations etc.\n     * Lead Dev Sec Ops design and execution for IT R&D applications, working with DevSecOps CoE and Infrastructure/Operations team using the likes of GitLab, Kubernetes, AWS Cloud Formation, AWS Systems Manager, AWS Config, etc.\n     * Architect and manage infrastructure as code, utilizing tools like Terraform, Ansible, or similar, to provision and manage resources across cloud environments.\n\n     * Implement and manage CI/CD pipelines , containerization with modular architecture using microservices, infrastructure provisioning and management, ensuring rapid and reliable application deployment.\n     * Optimize cloud resource utilization by designing and implementing efficient automation scripts , monitoring resources , and proactively addressing resource-related issues.\n     * Establish and enforce Dev Sec Ops best practices, including version control, code review, automated testing, and deployment strategies for continuous integration, continuous delivery, and automated testing.\n     * Collaborate with Security and Compliance teams to ensure teams are adhering to industry best practices and regulatory requirements. Create and maintain automated security testing tools to identify vulnerabilities and security risks , collaborate with cross-functional teams to ensure security practices align with industry standards.\n     * E xecute vulnerability assessment, threat modeling, compliance standards, security automation, secure coding practices, adhering to best practices for GxP, GDPR and other regulatory compliance.\n     * Monitor and analyze DevSecOps pipelines and practices, identifying areas for improvement, optimization, and automation to enhance launch/failback consistency and accuracy.\n     * Identify opportunities to use AI tools in DevSecOps related tasks such as Application Security and monitoring, testing (unit, integration, SAST, DAST), integrating security in DevSecOps pipeline, monitoring vulnerabilities, reporting security issues for driving productivity and efficiency.\n     * Collaborate with multidisciplinary teams including colleagues from Data & Analytics, Data Science & AI and Infrastructure Platform Engineering teams, Technical Product Owners, Technical Delivery leads, developers, data engineers, visualization engineers, data scientists, AI/ML e ngineers, b ioinformaticians, understand R&D domain-specific requirements and translate them into DevSecOps technical delivery.\n     * Embrace the Agile framework and Product-oriented-delivery , the iterative and incremental approach for solving technical problems to deliver IT R&D Digital products .\n     * Contribute to documentation, knowledge sharing within the engineering tea m and clearly communicate the function of release automation specifications , and procedures .\n     * Keep up to date with emerging data technologies, trends, and best practices, and make recommendations for their adoption within the Organization's DevSecOps ecosystem.\n     * Play a pivotal role in enabling infrastructure automation for application deployment, continuous improvement , and optimization of infrastructure, monitor and manage the cloud resources and coordinate/collaborate across teams within IT to empower our scientists and researchers in R&D.",
        "Datum gevonden": "2024-04-18",
        "Beroepsgroep": "Bedrijfskundig ingenieurs en deskundigen",
        "Beroepsklasse": "Engineering",
        "Contracttype": "Tijdelijk contract",
        "Parttime / fulltime": "Fulltime (> 32 uur)",
        "Branche": "Zakelijke dienstverlening",
        "Organisatiegrootte": "200-499",
        "Jaar (van datum gevonden)": 2024,
        "Maand (van datum gevonden)": 4,
        "full_text": "Senior Software Engineer, DevSecOps Release Mgmt, R&D Digital Products\n\nYour Role : We are looking for an innovation-centric Senior Software Engineer, DevSecOps Release Management ( R&D ) to join our IT R&D (Research & Development) Team who is passionate about leading the O rganizational T ransformation in developing DevSecOps tooling, practices, and culture for Genmab's Research and Development Department . You will contribute to R&D-wide DevSecOps requirements and ensure adoption of same, including observability, scalability, availability, security, cost performance. The Senior Software Engineer will also be responsible for DevSecOps technical expertise in Product-oriented-delivery teams, and ensuring that the PODs are executed on time , working with a team of architects and developers . The Senior Software Engineer will support R esearch , Discovery and D evelopment activities and leverage DevSecOps tool kits such as GitLab SaaS v ersion control software, Terraform, Cloud Formation, to ensure smooth and secure delivery of R&D\n   Digital Products, build and deploy scalable and resilient applications. The Senior Software Engineer, DevSecOps Release Management will be instrumental in maintaining robust CI/CD pipelines, enhancing security practices, optimizing cloud resource managemen t , driving operational efficiency and success for the R&D Organization.\n\n   This position will be based out of our Princeton, NJ , Copenhagen, DK or Utrecht, NL and onsite 60% .\n\n   Your Responsibility :\n     * Develop and maintain CI/CD pipelines using GitLab to streamline testing, deployment, and monitoring of applications and their associated infrastructure for software applications and systems used by the R&D Organization for R&D functions such as Research Informatics, SDMS (Scientific Data Management System), Lab Management Systems, Lab and Data Integrations, Research Data products, Pathology, Imaging, Pharmacology, Development Operations etc.\n     * Lead Dev Sec Ops design and execution for IT R&D applications, working with DevSecOps CoE and Infrastructure/Operations team using the likes of GitLab, Kubernetes, AWS Cloud Formation, AWS Systems Manager, AWS Config, etc.\n     * Architect and manage infrastructure as code, utilizing tools like Terraform, Ansible, or similar, to provision and manage resources across cloud environments.\n\n     * Implement and manage CI/CD pipelines , containerization with modular architecture using microservices, infrastructure provisioning and management, ensuring rapid and reliable application deployment.\n     * Optimize cloud resource utilization by designing and implementing efficient automation scripts , monitoring resources , and proactively addressing resource-related issues.\n     * Establish and enforce Dev Sec Ops best practices, including version control, code review, automated testing, and deployment strategies for continuous integration, continuous delivery, and automated testing.\n     * Collaborate with Security and Compliance teams to ensure teams are adhering to industry best practices and regulatory requirements. Create and maintain automated security testing tools to identify vulnerabilities and security risks , collaborate with cross-functional teams to ensure security practices align with industry standards.\n     * E xecute vulnerability assessment, threat modeling, compliance standards, security automation, secure coding practices, adhering to best practices for GxP, GDPR and other regulatory compliance.\n     * Monitor and analyze DevSecOps pipelines and practices, identifying areas for improvement, optimization, and automation to enhance launch/failback consistency and accuracy.\n     * Identify opportunities to use AI tools in DevSecOps related tasks such as Application Security and monitoring, testing (unit, integration, SAST, DAST), integrating security in DevSecOps pipeline, monitoring vulnerabilities, reporting security issues for driving productivity and efficiency.\n     * Collaborate with multidisciplinary teams including colleagues from Data & Analytics, Data Science & AI and Infrastructure Platform Engineering teams, Technical Product Owners, Technical Delivery leads, developers, data engineers, visualization engineers, data scientists, AI/ML e ngineers, b ioinformaticians, understand R&D domain-specific requirements and translate them into DevSecOps technical delivery.\n     * Embrace the Agile framework and Product-oriented-delivery , the iterative and incremental approach for solving technical problems to deliver IT R&D Digital products .\n     * Contribute to documentation, knowledge sharing within the engineering tea m and clearly communicate the function of release automation specifications , and procedures .\n     * Keep up to date with emerging data technologies, trends, and best practices, and make recommendations for their adoption within the Organization's DevSecOps ecosystem.\n     * Play a pivotal role in enabling infrastructure automation for application deployment, continuous improvement , and optimization of infrastructure, monitor and manage the cloud resources and coordinate/collaborate across teams within IT to empower our scientists and researchers in R&D."
    },
    "analysis": {
        "profile_classification": {
            "profile": "Ambiguous / Not Relevant",
            "confidence_score": 2,
            "rationale": "The job description heavily focuses on DevSecOps, release management, and traditional software engineering practices within an R&D context. While AI tools are mentioned as a potential area for productivity enhancement, the core responsibilities do not align with building or deploying AI models or generative systems, which are central to ML Engineer and GenAI Engineer roles."
        },
        "thematic_analysis": {
            "job_tasks": [
                {
                    "category": "TASK1: Business Understanding",
                    "phrases": [
                        "leading the O rganizational T ransformation in developing DevSecOps tooling, practices, and culture for Genmab's Research and Development Department",
                        "contribute to R&D-wide DevSecOps requirements and ensure adoption of same",
                        "understand R&D domain-specific requirements and translate them into DevSecOps technical delivery",
                        "support R esearch , Discovery and D evelopment activities",
                        "empower our scientists and researchers in R&D"
                    ],
                    "justification": "These phrases indicate an understanding of the business context (R&D department, specific R&D functions) and the need to align technical solutions (DevSecOps tooling, practices) with strategic goals and domain-specific requirements."
                },
                {
                    "category": "TASK2: Data Engineering",
                    "phrases": [
                        "SDMS (Scientific Data Management System)",
                        "Lab Management Systems",
                        "Lab and Data Integrations",
                        "Research Data products",
                        "data engineers"
                    ],
                    "justification": "While not a primary focus, the mention of data management systems and data engineers suggests some involvement or interaction with data engineering processes within the R&D context."
                },
                {
                    "category": "TASK3: Modeling",
                    "phrases": [
                        "AI tools in DevSecOps related tasks such as Application Security and monitoring, testing (unit, integration, SAST, DAST), integrating security in DevSecOps pipeline, monitoring vulnerabilities, reporting security issues for driving productivity and efficiency",
                        "data scientists",
                        "AI/ML engineers"
                    ],
                    "justification": "The job description mentions the *use* of AI tools for specific DevSecOps tasks and collaboration with Data Scientists and AI/ML engineers. However, it does not describe the development, training, or fine-tuning of AI models themselves."
                },
                {
                    "category": "TASK4: Software Development",
                    "phrases": [
                        "Senior Software Engineer",
                        "develop and maintain CI/CD pipelines",
                        "applications and their associated infrastructure",
                        "software applications and systems",
                        "build and deploy scalable and resilient applications",
                        "containerization with modular architecture using microservices",
                        "rapid and reliable application deployment",
                        "secure coding practices",
                        "secure delivery of R&D Digital Products"
                    ],
                    "justification": "This role is fundamentally a software engineering position focused on building, deploying, and maintaining applications and infrastructure, with a strong emphasis on CI/CD and microservices architecture."
                },
                {
                    "category": "TASK5: Operations Engineering (MLOps)",
                    "phrases": [
                        "DevSecOps Release Mgmt",
                        "DevSecOps tooling, practices, and culture",
                        "observability, scalability, availability, security, cost performance",
                        "DevSecOps technical expertise",
                        "Product-oriented-delivery teams",
                        "DevSecOps tool kits",
                        "smooth and secure delivery",
                        "DevSecOps Release Management",
                        "robust CI/CD pipelines",
                        "enhancing security practices",
                        "optimizing cloud resource management",
                        "driving operational efficiency",
                        "Lead Dev Sec Ops design and execution",
                        "infrastructure as code",
                        "provision and manage resources across cloud environments",
                        "infrastructure provisioning and management",
                        "efficient automation scripts",
                        "monitoring resources",
                        "proactively addressing resource-related issues",
                        "Establish and enforce Dev Sec Ops best practices",
                        "version control, code review, automated testing, and deployment strategies",
                        "continuous integration, continuous delivery, and automated testing",
                        "automated security testing tools",
                        "Monitor and analyze DevSecOps pipelines and practices",
                        "areas for improvement, optimization, and automation",
                        "launch/failback consistency and accuracy",
                        "integrating security in DevSecOps pipeline",
                        "enabling infrastructure automation for application deployment",
                        "continuous improvement , and optimization of infrastructure",
                        "monitor and manage the cloud resources"
                    ],
                    "justification": "The job title and numerous responsibilities explicitly detail DevSecOps, CI/CD pipelines, infrastructure as code, cloud resource management, security practices, monitoring, and automation, which are core components of Operations Engineering (MLOps/DevSecOps)."
                }
            ],
            "technologies": [
                {
                    "category": "TECH1: Programming Languages",
                    "technologies": [
                        "Python"
                    ]
                },
                {
                    "category": "TECH2: Cloud Platforms & Services",
                    "technologies": [
                        "AWS Cloud Formation",
                        "AWS Systems Manager",
                        "AWS Config"
                    ]
                },
                {
                    "category": "TECH3: LLM / Generative Models",
                    "technologies": []
                },
                {
                    "category": "TECH4: LLM Frameworks & Libraries",
                    "technologies": []
                },
                {
                    "category": "TECH5: Vector Stores & Search",
                    "technologies": []
                },
                {
                    "category": "TECH6: MLOps & Data Pipelines",
                    "technologies": [
                        "GitLab",
                        "Terraform",
                        "Ansible",
                        "Kubernetes",
                        "Docker"
                    ]
                },
                {
                    "category": "TECH7: Data Visualization",
                    "technologies": []
                },
                {
                    "category": "TECH8: Data Processing",
                    "technologies": []
                },
                {
                    "category": "TECH9: Data Storage",
                    "technologies": []
                },
                {
                    "category": "TECH10: Data Modeling",
                    "technologies": []
                },
                {
                    "category": "TECH11: Data Analysis",
                    "technologies": []
                }
            ],
            "soft_skills": [
                {
                    "category": "SKILL1: Communication & Collaboration",
                    "phrases": [
                        "working with a team of architects and developers",
                        "Collaborate with Security and Compliance teams",
                        "collaborate with cross-functional teams",
                        "Collaborate with multidisciplinary teams including colleagues from Data & Analytics, Data Science & AI and Infrastructure Platform Engineering teams, Technical Product Owners, Technical Delivery leads, developers, data engineers, visualization engineers, data scientists, AI/ML engineers, bioinformaticians",
                        "clearly communicate the function of release automation specifications , and procedures",
                        "coordinate/collaborate across teams within IT"
                    ],
                    "justification": "The role requires extensive collaboration with various teams (architects, developers, security, compliance, data science, AI/ML, platform engineering) and clear communication of technical specifications."
                },
                {
                    "category": "SKILL2: Learning & Adaptability",
                    "phrases": [
                        "innovation-centric",
                        "passionate about leading the O rganizational T ransformation",
                        "Keep up to date with emerging data technologies, trends, and best practices, and make recommendations for their adoption"
                    ],
                    "justification": "The emphasis on innovation, organizational transformation, and staying updated with emerging technologies highlights the need for continuous learning and adaptability."
                },
                {
                    "category": "SKILL3: Problem Solving & Pragmatism",
                    "phrases": [
                        "ensure smooth and secure delivery",
                        "build and deploy scalable and resilient applications",
                        "ensuring rapid and reliable application deployment",
                        "Optimize cloud resource utilization",
                        "proactively addressing resource-related issues",
                        "identifying areas for improvement, optimization, and automation",
                        "driving productivity and efficiency",
                        "iterative and incremental approach for solving technical problems",
                        "continuous improvement , and optimization of infrastructure"
                    ],
                    "justification": "The role involves solving complex technical challenges related to delivery, scalability, resource optimization, security, and efficiency, often through iterative and automated approaches."
                },
                {
                    "category": "SKILL4: Ethical & Legal Responsibility",
                    "phrases": [
                        "security, cost performance",
                        "ensure smooth and secure delivery",
                        "enhancing security practices",
                        "adhering to industry best practices and regulatory requirements",
                        "automated security testing tools to identify vulnerabilities and security risks",
                        "ensure security practices align with industry standards",
                        "E xecute vulnerability assessment, threat modeling, compliance standards, security automation, secure coding practices, adhering to best practices for GxP, GDPR and other regulatory compliance"
                    ],
                    "justification": "There is a strong emphasis on security, compliance, regulatory requirements (GxP, GDPR), vulnerability assessment, and ethical coding practices, indicating a need for ethical and legal responsibility."
                },
                {
                    "category": "SKILL5: Innovation & Ownership",
                    "phrases": [
                        "innovation-centric",
                        "leading the O rganizational T ransformation",
                        "Product-oriented-delivery",
                        "Embrace the Agile framework and Product-oriented-delivery",
                        "Play a pivotal role in enabling infrastructure automation",
                        "empower our scientists and researchers"
                    ],
                    "justification": "The job description highlights an 'innovation-centric' approach, leading organizational transformation, embracing Agile and product-oriented delivery, and taking a pivotal role, suggesting a need for initiative and ownership."
                }
            ]
        }
    }
}