{
    "job_id": 1011,
    "job_details": {
        "job_id": 1011,
        "Organisatienaam": "SKIM",
        "Type adverteerder": "Directe werkgever",
        "Vacaturetitel": "AI Engineer",
        "Standplaats": "Rotterdam",
        "Vacaturelink (origineel)": "engineering.jobs",
        "Contactpersoon": null,
        "Telefoonnummer": null,
        "E-mail": null,
        "Beroep": "Engineer (overig) (m/v/x)",
        "Opleidingsniveau": "WO",
        "Jobfeed feedbacklink": "Meld fout",
        "Functieomschrijving": "Company Description\n\n   Join us in pioneering AI Solutions for Market Research and shape its future! SKIM is a fast-growing marketing research consultancy with offices in the US, Europe, Asia and South America. We specialize in modelling and understanding people's decision making in the areas of New Product Development, Brand Communication and Revenue Growth Management & Pricing. In our vision, a combination of methodological robustness, marketing domain expertise and understanding the client's business is the key to building lasting strategic partnerships with our clients.\n\n   As evidenced by our #3 position in GRIT's report of most innovative research agencies, we believe in continuously improving our solutions and expertise frameworks. But above all else, we believe in a culture where smart, ambitious and genuine people support each other, follow their dreams, balance priorities in life and bring everyone's unique skills together in a collaborative global community.\n\n   Job Description\n\n   The AI Team is part of a larger Methodology & Analytics Team that helps create new innovative solutions for our analysts worldwide. We are looking for someone to join our AI Team and help us develop innovative cloud applications for market research clients. If you identify yourself as an AI Engineer, Machine Learning Engineer or Data Scientist and you like the idea of building cloud applications that leverage AI, then this job might be for you!\n\n   As an AI Engineer, you will play a crucial role in the growing and dynamic team. Specifically, you will:\n\n   Research & Develop\n     * Develop deep learning powered AI, especially LLM applications tailored for market research clients\n     * Support the development of interactive dashboards\n     * Work with LLM providers, such as OpenAI, Anthropic, Google, etc.\n     * Work with various cloud services, particularly AWS (EC2, ECS, Lambda, etc.).\n     * Collaborate closely with AI specialists, cloud experts and stakeholders to deliver robust, scalable solutions.\n       Guide & Lead\n     * Continuously learn more about business applications and propose innovative AI solutions to address business challenges. Taking the initiative is expected.\n     * Stay up to date with the latest AI and LLM developments.\n     * Help us develop internal trainings on AI/ML.\n       Qualifications\n       You will play a critical role in developing outstanding AI-enhanced market research solutions. The ideal candidate will have outstanding conceptual thinking and great execution when developing AI solutions Typically, we are looking for someone with the following profile:\n     * MSc or PhD in Computer Science, AI, or related fields. Formal education or significant practical experience in programming is essential.\n     * 2+ years of working experience on deep learning, NLP experience is preferred\n     * Interest in marketing and market research\n     * Experience in working with LLMs\n     * Experience with Docker and Git\n     * Proficiency in Python, PyTorch, and/or Tensorflow\n     * Proven experience of creating MVPs using Streamlit, Gradio or similar\n     * Experience with Cloud Computing and Deployment (AWS, Azure and/or GCP)\n     * Interest in learning business applications of AI\n     * Excellent written and oral communication skills in English\n       Additionally, the following are a plus:\n     * Experience with CI/CD and IaC (Terraform, CloudFormation etc.)\n     * Some experience with R, in order to help R/Shiny developers\n     * Experience in dashboard development and maintenance\n     * Experience with web development frameworks such as Flask\n       Our offer\n     * SKIM is an equal opportunity employer and offers a flexible working environment and people-centric culture where people who appreciate intellectual freedom, team play and a \"can do\" mentality thrive. We offer a competitive salary & benefits package that includes the following:\n     * Annual performance-based and profit-sharing bonus\n     * A hybrid working environment\n     * High value placed on taking initiative and ownership\n     * Passionate, intelligent, and supporting colleagues\n     * Open, communicative, and international work environment\n     * Flat organizational structure\n     * Focus on true work / life balance\n     * Regular team outings and events\n     * SKIM University with a broad selection of trainings\n     * Company pension scheme\n       At SKIM, we value diversity, equity and inclusion. With increased diversity comes greater variety of perspectives, ideas and creativity, and we foster an environment where everyone feels welcome and comfortable to be their authentic selves. Therefore, we welcome diversity in applicants and base our hiring decisions regardless of age, race, color, religion, ethnicity, nationality, gender, pregnancy, sexual orientation, gender identity, disability, genetic characteristics, marital or military status.\n       Additional Information\n       Thank you for taking the time to read the description of this role, and we look forward to reading your submission if this role sounds very exciting to you! We read each application carefully and will get back to you as soon as we can.",
        "Datum gevonden": "2024-11-26",
        "Beroepsgroep": "Engineering (overig)",
        "Beroepsklasse": "Engineering",
        "Contracttype": "Vast contract",
        "Parttime / fulltime": "Fulltime (> 32 uur)",
        "Branche": "Overig / Onbekend",
        "Organisatiegrootte": "1-9",
        "Jaar (van datum gevonden)": 2024,
        "Maand (van datum gevonden)": 11,
        "full_text": "AI Engineer\n\nCompany Description\n\n   Join us in pioneering AI Solutions for Market Research and shape its future! SKIM is a fast-growing marketing research consultancy with offices in the US, Europe, Asia and South America. We specialize in modelling and understanding people's decision making in the areas of New Product Development, Brand Communication and Revenue Growth Management & Pricing. In our vision, a combination of methodological robustness, marketing domain expertise and understanding the client's business is the key to building lasting strategic partnerships with our clients.\n\n   As evidenced by our #3 position in GRIT's report of most innovative research agencies, we believe in continuously improving our solutions and expertise frameworks. But above all else, we believe in a culture where smart, ambitious and genuine people support each other, follow their dreams, balance priorities in life and bring everyone's unique skills together in a collaborative global community.\n\n   Job Description\n\n   The AI Team is part of a larger Methodology & Analytics Team that helps create new innovative solutions for our analysts worldwide. We are looking for someone to join our AI Team and help us develop innovative cloud applications for market research clients. If you identify yourself as an AI Engineer, Machine Learning Engineer or Data Scientist and you like the idea of building cloud applications that leverage AI, then this job might be for you!\n\n   As an AI Engineer, you will play a crucial role in the growing and dynamic team. Specifically, you will:\n\n   Research & Develop\n     * Develop deep learning powered AI, especially LLM applications tailored for market research clients\n     * Support the development of interactive dashboards\n     * Work with LLM providers, such as OpenAI, Anthropic, Google, etc.\n     * Work with various cloud services, particularly AWS (EC2, ECS, Lambda, etc.).\n     * Collaborate closely with AI specialists, cloud experts and stakeholders to deliver robust, scalable solutions.\n       Guide & Lead\n     * Continuously learn more about business applications and propose innovative AI solutions to address business challenges. Taking the initiative is expected.\n     * Stay up to date with the latest AI and LLM developments.\n     * Help us develop internal trainings on AI/ML.\n       Qualifications\n       You will play a critical role in developing outstanding AI-enhanced market research solutions. The ideal candidate will have outstanding conceptual thinking and great execution when developing AI solutions Typically, we are looking for someone with the following profile:\n     * MSc or PhD in Computer Science, AI, or related fields. Formal education or significant practical experience in programming is essential.\n     * 2+ years of working experience on deep learning, NLP experience is preferred\n     * Interest in marketing and market research\n     * Experience in working with LLMs\n     * Experience with Docker and Git\n     * Proficiency in Python, PyTorch, and/or Tensorflow\n     * Proven experience of creating MVPs using Streamlit, Gradio or similar\n     * Experience with Cloud Computing and Deployment (AWS, Azure and/or GCP)\n     * Interest in learning business applications of AI\n     * Excellent written and oral communication skills in English\n       Additionally, the following are a plus:\n     * Experience with CI/CD and IaC (Terraform, CloudFormation etc.)\n     * Some experience with R, in order to help R/Shiny developers\n     * Experience in dashboard development and maintenance\n     * Experience with web development frameworks such as Flask\n       Our offer\n     * SKIM is an equal opportunity employer and offers a flexible working environment and people-centric culture where people who appreciate intellectual freedom, team play and a \"can do\" mentality thrive. We offer a competitive salary & benefits package that includes the following:\n     * Annual performance-based and profit-sharing bonus\n     * A hybrid working environment\n     * High value placed on taking initiative and ownership\n     * Passionate, intelligent, and supporting colleagues\n     * Open, communicative, and international work environment\n     * Flat organizational structure\n     * Focus on true work / life balance\n     * Regular team outings and events\n     * SKIM University with a broad selection of trainings\n     * Company pension scheme\n       At SKIM, we value diversity, equity and inclusion. With increased diversity comes greater variety of perspectives, ideas and creativity, and we foster an environment where everyone feels welcome and comfortable to be their authentic selves. Therefore, we welcome diversity in applicants and base our hiring decisions regardless of age, race, color, religion, ethnicity, nationality, gender, pregnancy, sexual orientation, gender identity, disability, genetic characteristics, marital or military status.\n       Additional Information\n       Thank you for taking the time to read the description of this role, and we look forward to reading your submission if this role sounds very exciting to you! We read each application carefully and will get back to you as soon as we can."
    },
    "analysis": {
        "job_profile_classification": {
            "profile": "GenAI Engineer",
            "confidence_score": 4,
            "rationale": "The job description heavily emphasizes developing applications using Large Language Models (LLMs) and generative AI, including fine-tuning and working with LLM providers. It also highlights building user-facing cloud applications and integrating AI features, aligning with the core responsibilities of a GenAI Engineer."
        },
        "thematic_analysis": {
            "job_tasks": [
                {
                    "task_category": "TASK3: Modeling",
                    "phrases": [
                        "Develop deep learning powered AI, especially LLM applications tailored for market research clients",
                        "Work with LLM providers, such as OpenAI, Anthropic, Google, etc.",
                        "Experience in working with LLMs",
                        "deep learning",
                        "NLP experience is preferred",
                        "AI/ML"
                    ],
                    "justification": "These phrases directly relate to the development, adaptation, and use of machine learning models, specifically focusing on deep learning and Large Language Models (LLMs) for client applications."
                },
                {
                    "task_category": "TASK4: Software Development",
                    "phrases": [
                        "help us develop innovative cloud applications for market research clients",
                        "building cloud applications that leverage AI",
                        "develop outstanding AI-enhanced market research solutions",
                        "creating MVPs using Streamlit, Gradio or similar",
                        "Experience with web development frameworks such as Flask",
                        "Support the development of interactive dashboards",
                        "Experience in dashboard development and maintenance"
                    ],
                    "justification": "These phrases indicate the need to build and integrate AI capabilities into user-facing applications, including cloud applications, dashboards, and prototypes, requiring traditional software development skills."
                },
                {
                    "task_category": "TASK5: Operations Engineering (MLOps)",
                    "phrases": [
                        "Work with various cloud services, particularly AWS (EC2, ECS, Lambda, etc.)",
                        "Cloud Computing and Deployment (AWS, Azure and/or GCP)",
                        "Experience with Docker and Git",
                        "Experience with CI/CD and IaC (Terraform, CloudFormation etc.)"
                    ],
                    "justification": "These phrases point to the operational aspects of deploying and managing AI solutions in the cloud, including containerization, cloud services, and infrastructure as code, which are key components of MLOps."
                },
                {
                    "task_category": "TASK1: Business Understanding",
                    "phrases": [
                        "AI Solutions for Market Research",
                        "market research clients",
                        "marketing domain expertise",
                        "client's business",
                        "business applications and propose innovative AI solutions to address business challenges",
                        "Interest in marketing and market research",
                        "Interest in learning business applications of AI"
                    ],
                    "justification": "These phrases demonstrate the requirement to understand the market research domain, client needs, and business challenges to effectively apply AI solutions."
                },
                {
                    "task_category": "SKILL2: Learning & Adaptability",
                    "phrases": [
                        "Continuously learn more about business applications",
                        "Stay up to date with the latest AI and LLM developments",
                        "Interest in learning business applications of AI",
                        "SKIM University with a broad selection of trainings"
                    ],
                    "justification": "The job description explicitly mentions the need to stay current with AI advancements and learn about business applications, indicating a strong emphasis on continuous learning and adaptability."
                },
                {
                    "task_category": "SKILL5: Innovation & Ownership",
                    "phrases": [
                        "pioneering AI Solutions",
                        "shape its future",
                        "continuously improving our solutions",
                        "propose innovative AI solutions",
                        "Taking the initiative is expected",
                        "High value placed on taking initiative and ownership",
                        "can do\" mentality"
                    ],
                    "justification": "Phrases like 'pioneering', 'innovative', 'taking initiative', and 'ownership' highlight the expectation for proactive contribution and leadership in developing new AI solutions."
                },
                {
                    "task_category": "SKILL1: Communication & Collaboration",
                    "phrases": [
                        "Collaborate closely with AI specialists, cloud experts and stakeholders",
                        "Help us develop internal trainings on AI/ML",
                        "Excellent written and oral communication skills in English",
                        "passionate, intelligent, and supporting colleagues",
                        "Open, communicative, and international work environment"
                    ],
                    "justification": "The job requires close collaboration with various teams and stakeholders, as well as excellent communication skills, both written and oral, for effective teamwork and knowledge sharing."
                }
            ],
            "technologies": [
                {
                    "tech_category": "TECH3: LLM / Generative Models",
                    "technologies": [
                        "OpenAI",
                        "Anthropic",
                        "Google"
                    ]
                },
                {
                    "tech_category": "TECH2: Cloud Platforms & Services",
                    "technologies": [
                        "AWS",
                        "EC2",
                        "ECS",
                        "Lambda",
                        "Azure",
                        "GCP"
                    ]
                },
                {
                    "tech_category": "TECH6: MLOps & Data Pipelines",
                    "technologies": [
                        "Docker",
                        "Git",
                        "CI/CD",
                        "IaC",
                        "Terraform",
                        "CloudFormation"
                    ]
                },
                {
                    "tech_category": "TECH10: Data Modeling",
                    "technologies": [
                        "PyTorch",
                        "Tensorflow"
                    ]
                },
                {
                    "tech_category": "TECH1: Programming Languages",
                    "technologies": [
                        "Python",
                        "R",
                        "JavaScript"
                    ]
                },
                {
                    "tech_category": "TECH4: LLM Frameworks & Libraries",
                    "technologies": [
                        "Streamlit",
                        "Gradio",
                        "Flask"
                    ]
                }
            ],
            "soft_skills": [
                {
                    "skill_category": "SKILL1: Communication & Collaboration",
                    "skills": [
                        "Collaborate closely with AI specialists, cloud experts and stakeholders",
                        "Excellent written and oral communication skills in English",
                        "passionate, intelligent, and supporting colleagues",
                        "Open, communicative, and international work environment"
                    ]
                },
                {
                    "skill_category": "SKILL2: Learning & Adaptability",
                    "skills": [
                        "Continuously learn more about business applications",
                        "Stay up to date with the latest AI and LLM developments",
                        "Interest in learning business applications of AI",
                        "SKIM University with a broad selection of trainings"
                    ]
                },
                {
                    "skill_category": "SKILL3: Problem Solving & Pragmatism",
                    "skills": [
                        "Develop deep learning powered AI, especially LLM applications tailored for market research clients",
                        "propose innovative AI solutions to address business challenges",
                        "conceptual thinking and great execution when developing AI solutions"
                    ]
                },
                {
                    "skill_category": "SKILL5: Innovation & Ownership",
                    "skills": [
                        "pioneering AI Solutions",
                        "shape its future",
                        "continuously improving our solutions",
                        "propose innovative AI solutions",
                        "Taking the initiative is expected",
                        "High value placed on taking initiative and ownership",
                        "can do\" mentality"
                    ]
                },
                {
                    "skill_category": "SKILL4: Ethical & Legal Responsibility",
                    "skills": [
                        "responsible, fair, and transparent AI systems"
                    ]
                }
            ]
        }
    }
}