{
    "job_id": 933,
    "job_details": {
        "job_id": 933,
        "Organisatienaam": "KLM",
        "Type adverteerder": "Directe werkgever",
        "Vacaturetitel": "Senior Machine Learning Engineer",
        "Standplaats": "Amstelveen",
        "Vacaturelink (origineel)": "nationalevacaturebank.nl",
        "Contactpersoon": null,
        "Telefoonnummer": null,
        "E-mail": null,
        "Beroep": "Machine learning engineer (m/v/x)",
        "Opleidingsniveau": "WO",
        "Jobfeed feedbacklink": "Meld fout",
        "Functieomschrijving": "Ben jij gepassioneerd over het benutten van data om impactvolle zakelijke beslissingen te ondersteunen? Krijg jij energie van een dynamische en samenwerkingsgerichte werkomgeving waarin jouw analytische en technische vaardigheden echt tot hun recht komen? Bij KLM zijn we vastbesloten om onze datagedreven besluitvorming naar een hoger niveau te tillen. Daarom zoeken we een enthousiaste, proactieve en vaardige ML Engineer om ons innovatieve team te versterken.\n       Binnen onze afdeling Data, OR & AI werk je aan baanbrekende projecten die direct invloed hebben op onze operaties, de klanttevredenheid verhogen en grote zakelijke meerwaarde opleveren. Ben je klaar om echte uitdagingen aan te gaan en deel uit te maken van een vooruitstrevende organisatie? Dan horen we graag van je! Samen kunnen we de toekomst van de luchtvaart vormgeven met data.\n\nVoordat je je IDE of notebook opent om aan de slag te gaan, dompel je je volledig onder in de context van de business om de beste oplossing voor de uitdaging te bedenken. In je dagelijkse werk zul je je bezighouden met:\n          + Werken aan voorspellingsmodellen die binnen KLM Finance worden gebruikt om zakelijke problemen op te lossen of processen te optimaliseren.\n          + Overleggen met stakeholders en inhoudsdeskundigen om de onderliggende businessvraag en vereisten beter te begrijpen.\n          + Uitvoeren van exploratieve data-analyse om de datakwaliteit te beoordelen en belangrijke inzichten te verkrijgen.\n          + Onderzoeken en selecteren van een geschikte set potentiële modellen en loss functions die aansluiten bij het probleem, en validatiestrategieën bespreken met collega data scientisten.\n          + Creatief zijn met feature engineering: nieuwe databronnen combineren met traditionele datawarehouses of onze uitgebreide data lakes om de model performance te verbeteren.\n          + Experimenten uitvoeren en de metrics, parameters en metadata van je model loggen in een model registry om delen en reproduceerbaarheid te vergemakkelijken.\n          + Je model in productie brengen en samenwerken met engineers binnen en buiten het team om ervoor te zorgen dat de productie aan bedrijfsbrede standaarden voldoet.\n          + Je model onderhouden en/of verbeteren door monitoring, hertrainen, toevoegen van nieuwe features, enzovoort.\n          + Bijdragen aan onze aankomende transitie naar de cloud: vereisten en verbeteringen identificeren en deze communiceren met de betrokken partijen.\n          + Vertalen van Data Science-vereisten naar architecturale componenten en werkwijzen.\n          + Je belangrijkste inzichten delen tijdens community-evenementen.\n          + Plezier hebben en genieten van wat je doet!\n       We moedigen je aan - en verwachten ook - dat je 15-20% van je tijd besteedt aan leren, onderzoek doen en jezelf ontwikkelen. Dit kun je doen door cursussen te volgen, papers te lezen of gave hackprojecten uit te voeren met je collega's. De projecten die je in deze ontwikkeltijd oppakt, moeten gerelateerd zijn aan jouw rol, maar hoeven niet direct aan te sluiten bij de projecten waaraan je normaal werkt.\n\n+ Hoe kunnen we het risico van cash in vreemde valuta het beste beheren?\n          + Hoe kunnen we het contractteam ondersteunen bij het extraheren van tarieven uit contracten?\n          + Hoe kunnen we facturen vinden met onjuist geregistreerde btw?\n          + Kunnen we GenAI-modellen inzetten om inkomstenverlies tijdens ons facturatieproces te voorkomen?\n       De antwoorden op deze vragen hebben directe invloed op de operaties van KLM. Dit biedt volop kansen om te werken aan projecten die écht kosten besparen, klanttevredenheid verhogen en de omzet vergroten.\n\n+ ML-use cases in productie brengt, met een praktische en pragmatische aanpak.\n          + Een betrouwbare partner bent voor de business: je levert robuuste, geteste code, voert kwaliteitscontroles uit en onderhoudt bestaande oplossingen.\n          + Junior/medior data scientists en ML Engineers coacht: je bent een rolmodel en helpt hen zich te ontwikkelen tot de beste versie van zichzelf.\n          + Technisch leiderschap biedt.\n          + Het team ondersteunt bij het ontdekken en verkennen van nieuwe onderwerpen om hun leerproces en groei te stimuleren.\n       Technologieën die we momenteel gebruiken in het team (het is een pré als je deze al kent, of bereid bent ze te leren wanneer nodig.)): Python, Docker, Kubernetes, MLFlow, Dagster, Git, SQL, DBT, Grafana, Kibana, Prometheus, Spotfire, PowerBI, Atlassian Suite (Confluence, JIRA), GitHub (Actions), GCP.\n       Ontdek de voordelen van bij ons werken\n       Als je functie dit toelaat: thuiswerken en tot 8 weken werken vanuit het buitenland (EU en Caribisch gebied)\n       2% vrij te besteden ontwikkelbudget",
        "Datum gevonden": "2024-12-04",
        "Beroepsgroep": "IT R&D Professionals",
        "Beroepsklasse": "Informatie- en communicatietechnologie",
        "Contracttype": "Vast contract",
        "Parttime / fulltime": "Parttime / Fulltime",
        "Branche": "Logistiek",
        "Organisatiegrootte": "1000+",
        "Jaar (van datum gevonden)": 2024,
        "Maand (van datum gevonden)": 12,
        "full_text": "Senior Machine Learning Engineer\n\nBen jij gepassioneerd over het benutten van data om impactvolle zakelijke beslissingen te ondersteunen? Krijg jij energie van een dynamische en samenwerkingsgerichte werkomgeving waarin jouw analytische en technische vaardigheden echt tot hun recht komen? Bij KLM zijn we vastbesloten om onze datagedreven besluitvorming naar een hoger niveau te tillen. Daarom zoeken we een enthousiaste, proactieve en vaardige ML Engineer om ons innovatieve team te versterken.\n       Binnen onze afdeling Data, OR & AI werk je aan baanbrekende projecten die direct invloed hebben op onze operaties, de klanttevredenheid verhogen en grote zakelijke meerwaarde opleveren. Ben je klaar om echte uitdagingen aan te gaan en deel uit te maken van een vooruitstrevende organisatie? Dan horen we graag van je! Samen kunnen we de toekomst van de luchtvaart vormgeven met data.\n\nVoordat je je IDE of notebook opent om aan de slag te gaan, dompel je je volledig onder in de context van de business om de beste oplossing voor de uitdaging te bedenken. In je dagelijkse werk zul je je bezighouden met:\n          + Werken aan voorspellingsmodellen die binnen KLM Finance worden gebruikt om zakelijke problemen op te lossen of processen te optimaliseren.\n          + Overleggen met stakeholders en inhoudsdeskundigen om de onderliggende businessvraag en vereisten beter te begrijpen.\n          + Uitvoeren van exploratieve data-analyse om de datakwaliteit te beoordelen en belangrijke inzichten te verkrijgen.\n          + Onderzoeken en selecteren van een geschikte set potentiële modellen en loss functions die aansluiten bij het probleem, en validatiestrategieën bespreken met collega data scientisten.\n          + Creatief zijn met feature engineering: nieuwe databronnen combineren met traditionele datawarehouses of onze uitgebreide data lakes om de model performance te verbeteren.\n          + Experimenten uitvoeren en de metrics, parameters en metadata van je model loggen in een model registry om delen en reproduceerbaarheid te vergemakkelijken.\n          + Je model in productie brengen en samenwerken met engineers binnen en buiten het team om ervoor te zorgen dat de productie aan bedrijfsbrede standaarden voldoet.\n          + Je model onderhouden en/of verbeteren door monitoring, hertrainen, toevoegen van nieuwe features, enzovoort.\n          + Bijdragen aan onze aankomende transitie naar de cloud: vereisten en verbeteringen identificeren en deze communiceren met de betrokken partijen.\n          + Vertalen van Data Science-vereisten naar architecturale componenten en werkwijzen.\n          + Je belangrijkste inzichten delen tijdens community-evenementen.\n          + Plezier hebben en genieten van wat je doet!\n       We moedigen je aan - en verwachten ook - dat je 15-20% van je tijd besteedt aan leren, onderzoek doen en jezelf ontwikkelen. Dit kun je doen door cursussen te volgen, papers te lezen of gave hackprojecten uit te voeren met je collega's. De projecten die je in deze ontwikkeltijd oppakt, moeten gerelateerd zijn aan jouw rol, maar hoeven niet direct aan te sluiten bij de projecten waaraan je normaal werkt.\n\n+ Hoe kunnen we het risico van cash in vreemde valuta het beste beheren?\n          + Hoe kunnen we het contractteam ondersteunen bij het extraheren van tarieven uit contracten?\n          + Hoe kunnen we facturen vinden met onjuist geregistreerde btw?\n          + Kunnen we GenAI-modellen inzetten om inkomstenverlies tijdens ons facturatieproces te voorkomen?\n       De antwoorden op deze vragen hebben directe invloed op de operaties van KLM. Dit biedt volop kansen om te werken aan projecten die écht kosten besparen, klanttevredenheid verhogen en de omzet vergroten.\n\n+ ML-use cases in productie brengt, met een praktische en pragmatische aanpak.\n          + Een betrouwbare partner bent voor de business: je levert robuuste, geteste code, voert kwaliteitscontroles uit en onderhoudt bestaande oplossingen.\n          + Junior/medior data scientists en ML Engineers coacht: je bent een rolmodel en helpt hen zich te ontwikkelen tot de beste versie van zichzelf.\n          + Technisch leiderschap biedt.\n          + Het team ondersteunt bij het ontdekken en verkennen van nieuwe onderwerpen om hun leerproces en groei te stimuleren.\n       Technologieën die we momenteel gebruiken in het team (het is een pré als je deze al kent, of bereid bent ze te leren wanneer nodig.)): Python, Docker, Kubernetes, MLFlow, Dagster, Git, SQL, DBT, Grafana, Kibana, Prometheus, Spotfire, PowerBI, Atlassian Suite (Confluence, JIRA), GitHub (Actions), GCP.\n       Ontdek de voordelen van bij ons werken\n       Als je functie dit toelaat: thuiswerken en tot 8 weken werken vanuit het buitenland (EU en Caribisch gebied)\n       2% vrij te besteden ontwikkelbudget"
    },
    "analysis": {
        "job_profile_classification": {
            "profile": "ML Engineer",
            "confidence_score": 4,
            "rationale": "The job description heavily emphasizes predictive modeling, data analysis, feature engineering, and productionizing models for business problem-solving within finance. While it mentions AI and GenAI, the core focus remains on traditional ML tasks and MLOps, aligning best with the ML Engineer profile."
        },
        "thematic_analysis": {
            "job_tasks": [
                {
                    "category": "TASK1: Business Understanding",
                    "phrases": [
                        "het benutten van data om impactvolle zakelijke beslissingen te ondersteunen",
                        "dompel je je volledig onder in de context van de business om de beste oplossing voor de uitdaging te bedenken",
                        "Overleggen met stakeholders en inhoudsdeskundigen om de onderliggende businessvraag en vereisten beter te begrijpen",
                        "Hoe kunnen we het risico van cash in vreemde valuta het beste beheren?",
                        "Hoe kunnen we het contractteam ondersteunen bij het extraheren van tarieven uit contracten?",
                        "Hoe kunnen we facturen vinden met onjuist geregistreerde btw?",
                        "Kunnen we GenAI-modellen inzetten om inkomstenverlies tijdens ons facturatieproces te voorkomen?",
                        "ML-use cases in productie brengt, met een praktische en pragmatische aanpak.",
                        "Een betrouwbare partner bent voor de business: je levert robuuste, geteste code, voert kwaliteitscontroles uit en onderhoudt bestaande oplossingen."
                    ],
                    "justification": "These phrases highlight the need to understand business goals, translate them into technical requirements, and solve business problems using data and ML models."
                },
                {
                    "category": "TASK2: Data Engineering",
                    "phrases": [
                        "Creatief zijn met feature engineering: nieuwe databronnen combineren met traditionele datawarehouses of onze uitgebreide data lakes om de model performance te verbeteren."
                    ],
                    "justification": "This phrase directly refers to feature engineering, a key component of data engineering for ML model performance."
                },
                {
                    "category": "TASK3: Modeling",
                    "phrases": [
                        "Werken aan voorspellingsmodellen die binnen KLM Finance worden gebruikt om zakelijke problemen op te lossen of processen te optimaliseren.",
                        "Onderzoeken en selecteren van een geschikte set potentiële modellen en loss functions die aansluiten bij het probleem, en validatiestrategieën bespreken met collega data scientisten.",
                        "Experimenten uitvoeren en de metrics, parameters en metadata van je model loggen in een model registry om delen en reproduceerbaarheid te vergemakkelijken.",
                        "Je model onderhouden en/of verbeteren door monitoring, hertrainen, toevoegen van nieuwe features, enzovoort.",
                        "Kunnen we GenAI-modellen inzetten om inkomstenverlies tijdens ons facturatieproces te voorkomen?"
                    ],
                    "justification": "These phrases describe the core activities of building, selecting, training, evaluating, and maintaining machine learning models, including predictive and generative models."
                },
                {
                    "category": "TASK4: Software Development",
                    "phrases": [
                        "Je model in productie brengen en samenwerken met engineers binnen en buiten het team om ervoor te zorgen dat de productie aan bedrijfsbrede standaarden voldoet.",
                        "Vertalen van Data Science-vereisten naar architecturale componenten en werkwijzen."
                    ],
                    "justification": "These phrases indicate the need to integrate ML models into production systems and translate data science requirements into architectural components, which involves software development practices."
                },
                {
                    "category": "TASK5: Operations Engineering (MLOps)",
                    "phrases": [
                        "Experimenten uitvoeren en de metrics, parameters en metadata van je model loggen in een model registry om delen en reproduceerbaarheid te vergemakkelijken.",
                        "Je model in productie brengen en samenwerken met engineers binnen en buiten het team om ervoor te zorgen dat de productie aan bedrijfsbrede standaarden voldoet.",
                        "Je model onderhouden en/of verbeteren door monitoring, hertrainen, toevoegen van nieuwe features, enzovoort.",
                        "Bijdragen aan onze aankomende transitie naar de cloud: vereisten en verbeteringen identificeren en deze communiceren met de betrokken partijen.",
                        "ML-use cases in productie brengt, met een praktische en pragmatische aanpak.",
                        "een betrouwbare partner bent voor de business: je levert robuuste, geteste code, voert kwaliteitscontroles uit en onderhoudt bestaande oplossingen."
                    ],
                    "justification": "These phrases cover logging model experiments, deploying models to production, monitoring, retraining, cloud transition, and maintaining production systems, all core MLOps activities."
                }
            ],
            "technologies": [
                {
                    "category": "TECH1: Programming Languages",
                    "items": [
                        "Python"
                    ]
                },
                {
                    "category": "TECH2: Cloud Platforms & Services",
                    "items": [
                        "GCP"
                    ]
                },
                {
                    "category": "TECH3: LLM / Generative Models",
                    "items": [
                        "GenAI-modellen"
                    ]
                },
                {
                    "category": "TECH4: LLM Frameworks & Libraries",
                    "items": []
                },
                {
                    "category": "TECH5: Vector Stores & Search",
                    "items": []
                },
                {
                    "category": "TECH6: MLOps & Data Pipelines",
                    "items": [
                        "Docker",
                        "Kubernetes",
                        "MLFlow",
                        "Dagster",
                        "Git",
                        "DBT",
                        "Grafana",
                        "Kibana",
                        "Prometheus",
                        "GitHub (Actions)"
                    ]
                },
                {
                    "category": "TECH7: Data Visualization",
                    "items": [
                        "Spotfire",
                        "PowerBI"
                    ]
                },
                {
                    "category": "TECH8: Data Processing",
                    "items": []
                },
                {
                    "category": "TECH9: Data Storage",
                    "items": [
                        "datawarehouses",
                        "data lakes"
                    ]
                },
                {
                    "category": "TECH10: Data Modeling",
                    "items": []
                },
                {
                    "category": "TECH11: Data Analysis",
                    "items": [
                        "SQL"
                    ]
                }
            ],
            "soft_skills": [
                {
                    "category": "SKILL1: Communication & Collaboration",
                    "phrases": [
                        "dynamische en samenwerkingsgerichte werkomgeving",
                        "Overleggen met stakeholders en inhoudsdeskundigen",
                        "samenwerken met engineers binnen en buiten het team",
                        "communiceren met de betrokken partijen",
                        "belangrijkste inzichten delen tijdens community-evenementen",
                        "coacht: je bent een rolmodel en helpt hen zich te ontwikkelen tot de beste versie van zichzelf.",
                        "Het team ondersteunt bij het ontdekken en verkennen van nieuwe onderwerpen om hun leerproces en groei te stimuleren."
                    ]
                },
                {
                    "category": "SKILL2: Learning & Adaptability",
                    "phrases": [
                        "enthousiaste, proactieve en vaardige ML Engineer",
                        "bereid bent ze te leren wanneer nodig",
                        "15-20% van je tijd besteedt aan leren, onderzoek doen en jezelf ontwikkelen",
                        "cursussen te volgen, papers te lezen of gave hackprojecten uit te voeren met je collega's."
                    ]
                },
                {
                    "category": "SKILL3: Problem Solving & Pragmatism",
                    "phrases": [
                        "benutten van data om impactvolle zakelijke beslissingen te ondersteunen",
                        "baanbrekende projecten die direct invloed hebben op onze operaties, de klanttevredenheid verhogen en grote zakelijke meerwaarde opleveren",
                        "echte uitdagingen aan te gaan",
                        "dompel je je volledig onder in de context van de business om de beste oplossing voor de uitdaging te bedenken",
                        "zakelijke problemen op te lossen of processen te optimaliseren",
                        "onderliggende businessvraag en vereisten beter te begrijpen",
                        "belangrijke inzichten te verkrijgen",
                        "model performance te verbeteren",
                        "praktische en pragmatische aanpak",
                        "robuuste, geteste code"
                    ]
                },
                {
                    "category": "SKILL4: Ethical & Legal Responsibility",
                    "phrases": []
                },
                {
                    "category": "SKILL5: Innovation & Ownership",
                    "phrases": [
                        "proactieve en vaardige ML Engineer",
                        "innovatieve team",
                        "baanbrekende projecten",
                        "Creatief zijn met feature engineering",
                        "gave hackprojecten uit te voeren",
                        "Technisch leiderschap biedt."
                    ]
                }
            ]
        }
    }
}